{
  "$schema": "./schema.json",
  "schemaVersion": 1,
  "campaign": {
    "title": "The Grand Blooming",
    "subtitle": "A living record of promises, discoveries, and consequences"
  },
  "questStatuses": [
    { "id": "available", "label": "Available" },
    { "id": "active", "label": "Active" },
    { "id": "completed", "label": "Completed" },
    { "id": "failed", "label": "Failed" }
  ],
  "entries": [
    {
      "id": "quest-bells-beneath-brackenford",
      "type": "quest",
      "title": "The Bells Beneath Brackenford",
      "summary": "A bell rings under the flooded chapel each night, and someone in the village answers.",
      "body": "<p>Three nights ago, the old chapel bell began sounding from somewhere below the waterline. Each time it rings, a different villager leaves home and walks toward the marsh.</p><p>Warden Elian believes the submerged crypt can be reached through a collapsed ossuary behind the chapel.</p>",
      "visibility": "players",
      "revision": 1,
      "tags": ["Brackenford", "mystery", "marsh"],
      "quest": {
        "status": "active",
        "scope": "party",
        "rank": "C",
        "new": false,
        "postedAt": "Session 1",
        "giver": "Warden Elian Voss",
        "location": "Brackenford",
        "rewards": "75 gp and the Warden's sealed favor",
        "objectives": [
          { "id": "question-witnesses", "text": "Question the villagers who heard the bell" },
          { "id": "enter-crypt", "text": "Find a safe route into the flooded crypt" },
          { "id": "silence-bell", "text": "Discover who—or what—is ringing the bell" }
        ]
      }
    },
    {
      "id": "quest-cartographers-last-route",
      "type": "quest",
      "title": "The Cartographer's Last Route",
      "summary": "Recover a missing surveyor's field book before the royal road is drawn through sacred ground.",
      "body": "<p>Royal surveyor Mara Quill vanished while charting the western ridge. Her unfinished route crosses land claimed by the Thornwake Circle, and both sides want her field book.</p><p>The party must decide who receives the recovered map—or whether the route should remain lost.</p>",
      "visibility": "players",
      "revision": 1,
      "tags": ["western ridge", "factions", "exploration"],
      "quest": {
        "status": "available",
        "scope": "party",
        "rank": "B",
        "new": true,
        "postedAt": "After Session 2",
        "giver": "Quartermaster Renn",
        "location": "The Western Ridge",
        "rewards": "A royal travel writ and 100 gp",
        "objectives": [
          { "id": "find-camp", "text": "Locate Mara Quill's last camp" },
          { "id": "recover-book", "text": "Recover the field book" },
          { "id": "choose-recipient", "text": "Decide who receives the route" }
        ]
      }
    },
    {
      "id": "quest-crown-fragment",
      "type": "quest",
      "title": "A Fragment of the Crown",
      "summary": "The shard recovered below Brackenford may be one piece of the Ashen Crown.",
      "body": "<p>The recovered metal is warm despite the marsh water. Archivist Seln has identified the etched phrase along its rim, but has not told the party what it means.</p><p><strong>GM lead:</strong> Seln serves the Cinder Court and intends to replace the shard with a forgery.</p>",
      "visibility": "gm",
      "revision": 1,
      "tags": ["main plot", "Ashen Crown", "secret"],
      "quest": {
        "status": "active",
        "scope": "party",
        "rank": "S",
        "new": false,
        "postedAt": "Secret",
        "giver": "Archivist Seln",
        "location": "The Lantern Archive",
        "rewards": "Revelation of the crown's first bearer",
        "objectives": [
          { "id": "test-shard", "text": "Test the shard's properties" },
          { "id": "watch-seln", "text": "Determine whether Seln can be trusted" }
        ]
      }
    },
    {
      "id": "quest-promise-under-starlight",
      "type": "quest",
      "title": "A Promise Under Starlight",
      "summary": "Lyra's childhood promise points toward a ruined observatory, and she is asking the whole party to come with her.",
      "body": "<p>Years ago, Lyra promised her missing brother that they would watch the Starfall together from the old hilltop observatory. A blue-glass message bearing his sign has now arrived at the guild.</p><p>This is Lyra's personal quest, but every adventurer who joins may help decide how that promise is fulfilled.</p>",
      "visibility": "players",
      "revision": 1,
      "tags": ["personal quest", "observatory", "family"],
      "quest": {
        "status": "available",
        "scope": "personal",
        "owner": "Lyra Vale",
        "rank": "Personal",
        "new": true,
        "postedAt": "After Session 2",
        "giver": "Lyra Vale",
        "location": "The Starfall Observatory",
        "rewards": "Lyra's trust and the truth behind the blue-glass message",
        "objectives": [
          { "id": "decode-message", "text": "Decode the blue-glass message" },
          { "id": "reach-observatory", "text": "Reach the Starfall Observatory" },
          { "id": "keep-promise", "text": "Help Lyra decide how to keep her promise" }
        ]
      }
    },
    {
      "id": "lore-ashen-crown",
      "type": "lore",
      "title": "The Ashen Crown",
      "summary": "A royal relic destroyed at the end of the Cinder War—or so the histories claim.",
      "body": "<p>The Ashen Crown belonged to Queen Merrow, the final sovereign of the old river kingdom. Songs say she broke it upon the Ember Gate rather than let the invading host claim its authority.</p><p>Modern copies of the tale omit a troublesome detail: no witness ever described seeing the crown break.</p>",
      "visibility": "players",
      "revision": 1,
      "tags": ["relic", "Cinder War", "royalty"],
      "lore": { "category": "Relics" }
    },
    {
      "id": "lore-thornwake-circle",
      "type": "lore",
      "title": "The Thornwake Circle",
      "summary": "Wardens of the western old-growth who preserve promises in living bark.",
      "body": "<p>The Thornwake Circle does not write treaties. Its members carve each promise into a rowan tree, then tend that tree for as long as the agreement stands.</p><p>Cutting down a treaty-tree is considered both a declaration of war and an admission that the promise was broken.</p>",
      "visibility": "players",
      "revision": 1,
      "tags": ["faction", "western ridge", "druids"],
      "lore": { "category": "Factions" }
    },
    {
      "id": "history-session-01",
      "type": "history",
      "title": "The Road into Brackenford",
      "summary": "The party reached Brackenford during a storm and stopped a sleepwalking villager at the edge of the marsh.",
      "body": "<p>Rain erased the north road behind the party. Near midnight, the chapel bell sounded beneath the marsh and Toma Reed walked barefoot from his home. The party woke him before he reached the black water.</p><p>Warden Elian offered shelter and asked the group to remain until dawn.</p>",
      "visibility": "players",
      "revision": 1,
      "tags": ["session 1", "Brackenford"],
      "history": { "date": "Session 1", "sort": "001" }
    },
    {
      "id": "history-session-02",
      "type": "history",
      "title": "A Door Below the Water",
      "summary": "Tracks led from the chapel to an ossuary door concealed by reeds and recent stonework.",
      "body": "<p>The party found three sets of footprints at the chapel: Toma's, the Warden's, and a third trail that began at the water's edge. Behind the ruined ossuary they discovered fresh mortar sealing an older stair.</p>",
      "visibility": "players",
      "revision": 1,
      "tags": ["session 2", "Brackenford", "clue"],
      "history": { "date": "Session 2", "sort": "002" }
    }
  ]
}
